{
  "manifestVersion": 1,
  "id": "com.example.hello",
  "name": "Hello",
  "version": "1.0.0",
  "publisher": "P",
  "engines": {
    "spagitty": ">=0.9.0, <1.0.0",
    "extensionApi": "^1.0.0"
  },
  "runtime": {
    "kind": "native-process",
    "entrypoints": {
      "x86_64-unknown-linux-gnu": "bin/linux-x64/hello"
    }
  }
}
